{
  "id": "a1b2c3d4-e5f6-7890-abcd-ef1234567890",
  "client_order_id": "my-order-001",
  "symbol": "BTC/USD",
  "side": "buy",
  "type": "limit",
  "status": "new",
  "price": "50000.00",
  "quantity": "0.1",
  "filled_quantity": "0",
  "remaining_quantity": "0.1",
  "cumulative_quote_quantity": "0",
  "avg_price": "0",
  "time_in_force": "gtc",
  "created_at": "2026-01-15T10:30:00Z",
  "updated_at": "2026-01-15T10:30:00Z"
}
